{
  "id": "xhs-xlab-ad9-anniversary-intro",
  "provider": "xhs",
  "xhs_post_id": "6a02f461000000003502cee5",
  "title": "X-LAB AD9 30th-anniversary overview",
  "channel_name": "骑行公理",
  "url": "https://www.xiaohongshu.com/explore/6a02f461000000003502cee5",
  "language": "zh-Hans",
  "accessed_at": "2026-09-29",
  "target": {
    "candidate_id": "xlab-ad9"
  },
  "match": "exact-model-lead",
  "format": "model-overview",
  "relationship": "publication-review",
  "disclosure": "Creator model overview; product supply or sponsorship was not established from the capture.",
  "disclosure_url": "https://www.xiaohongshu.com/explore/6a02f461000000003502cee5",
  "summary": "Short introduction to the exact AD9 30th-anniversary model, separate from build and ride videos.",
  "source_capture_archive": "xhs-complete-X-LAB-AD9-2026-08-27T12-39-17-941Z.zip",
  "source_archive_sha256": "57f7141d124dcc2fe8344c37f55803d245697763fd42596041c02cec21e36ede"
}
