{
  "id": "the-bike-sauce-elitewheels-drive-50d-ii-review",
  "provider": "youtube",
  "youtube_video_id": "-KFXtH2DWGI",
  "title": "EliteWheels Drive II // They Fixed MOST of the Issues.",
  "channel_name": "The Bike Sauce",
  "channel_url": "https://www.youtube.com/channel/UC9pM0o0ceThIrNoYTXkFmqw",
  "url": "https://www.youtube.com/watch?v=-KFXtH2DWGI",
  "language": "en",
  "published_at": "2025-11-16",
  "accessed_at": "2026-10-23",
  "target": {
    "wheelset_id": "elitewheels-drive-50d-ii"
  },
  "match": "exact-wheelset",
  "format": "hands-on-review",
  "relationship": "retailer-linked",
  "disclosure": "The description offers a 20% Elitewheels discount code and links the creator’s shop; it does not say how the wheels were obtained.",
  "disclosure_url": "https://www.youtube.com/watch?v=-KFXtH2DWGI",
  "summary": "Ride review of the Drive II 50D road wheels that weighs which concerns with the original Drive wheels were fixed and which one remains."
}
