{
  "id": "icanbikes-gra04-race-build",
  "provider": "youtube",
  "youtube_video_id": "o2Es2mgVZW0",
  "title": "ICANBIKES GRA04 Full Carbon Racing Gravel Bike Build- win the honor of 2026 114 Gravel Race Winner",
  "channel_name": "icanian",
  "channel_url": "https://www.youtube.com/@icanian",
  "url": "https://www.youtube.com/watch?v=o2Es2mgVZW0",
  "language": "en",
  "published_at": "2026-04-29",
  "accessed_at": "2026-10-24",
  "target": {
    "platform_id": "ican-gra04"
  },
  "match": "exact-platform",
  "format": "build-and-ride",
  "relationship": "brand-published",
  "disclosure": "Published by the ICAN (icanbikes) brand channel; the description repeats brand claims about weight, materials and a race win.",
  "disclosure_url": "https://www.youtube.com/watch?v=o2Es2mgVZW0",
  "summary": "Brand step-by-step build of a GRA04 race bike. The description's weight, fiber and race-result claims are brand statements and are not used as catalog evidence."
}
